processed_sentence,sentiment
im side town definitely spot ill hit,1
good work fine,1
price good,1
still quite interesting entertain follow,1
far sushi connoisseur definitely tell difference good food bad food certainly bad food,0
dont waste money,0
insult profound deuchebaggery go outside smoke break serve solidify,0
good case excellent value,1
central theme film handle ineptly stereotypically depth imagination,0
also didnt like button felt like would crack use,0
movie mindbendingly awful couldnt even create,0
goldencrispy delicious,1
bad quality,0
duet astronaut doctor beginning movie perfect exchange one consider movie make well cold war astronaut big fear crash ussr,1
disappointing thing speakerphone,0
dont waste time watch rubbish nonresearched film,0
good audio quality,1
battery life real good,1
several moment movie didnt need excruciatingly slow move,0
headset fulfills requirement happy purchase,1
one note ventilation could use upgrading,0
restaurant always full never wait,1
several dozen several hundred contact imagine fun send one one,0
strike want rush,0
crostini come salad stale,0
food quality horrible,0
great product,1
highly recommend case,1
felt like gripping intelligent stage play without overly theatrical feel one actually get watch people stage play everyones terror white lie escalate monstrous consequence,1
like really sexy party mouth youre outrageously flirt hot person party,1
ambience perfect,1
great product fast shipping,1
great value,1
problem item would order need,1
excellent phone,1
lose marble early proceeding totally implausible unconvincing,0
im use iriver spinn case fit fine,1
conclusion filling meal,1
rate movie,1
nearly good look amazon picture make look,0
cant say enough good thing place,1
great food,1
plug work well,0
food par dennys say good,0
personally love hummus pita baklava falafel baba ganoush amaze eggplant,1
server go back forth several time even much help,0
great service food,1
definitly recommend,1
pizza taste old super chewy good way,0
company charge restock fee still give refund back,0
presentation food awful,0
best phone market,1
still good actor around,1
server nice even though look little overwhelmed need stay professional friendly end,1
nonlinear narration thus many flashback every part articulate quite well,1
enjoy,1
overall rate movie scale,1
nice headphone price work great,1
badwellits bad,0
one best italian thriller early,1
one bad sandra bullock movie since speed quite bad,0
nutshell restaraunt smell like combination dirty fish market sewer,0
cutout button place perfectly,1
good selection food include massive meatloaf sandwich crispy chicken wrap delish tuna melt tasty burger,1
drink take close minute come one point,0
text messaging feature really tricky use,0
probably irritating show ever see entire life,0
film deserve strong kudos take stand exceptional act mostly lesserknown cast superintelligent script doesnt insult audience take easy way come white racism,1
sashimi poor quality soggy tasteless,0
razr owneryou must,1
anyway plot flow smoothly malebonding scene hoot,1
place good film garbage,0
problem script,0
there barely boring moment film plenty humorous part,1
real improvement,0
read please dont go,0
oh charger seem work fine,1
plot pretty much every cheap horror,0
order correct,0
good side staff genuinely pleasant enthusiastic real treat,1
saggy floppy piece junk,0
volume ringer real good choice loud,1
sister one also love,1
cant see movie inspiration anyone come overcome fear rejection,0
excited get headset think really cute,1
almost unbearable watch screen little charisma terrible comedic timing,0
reversible plug work great,1
highly recommend encourage people give try,1
salad bland vinegrette baby green heart palm,0
definitely worth check,1
im really sure joeys vote best hot dog valley reader phoenix magazine,0
good servicecheck,1
impressed headset plantronics,1
unreliable im give,0
ill put gem movie term screenplay cinematography act postproduction edit direct aspect filmmaking,1
steak shrimp opinion best entree gc,1
waitress manager friendly,1
despite pan reviewer like movie,1
big complaint battery drain superfast,0
politically correct,0
take hour get food table restaurant food luke warm sever run around like totally overwhelmed,0
well make fit surefire perfectly,1
headset easy use everyone love,1
advise look,1
warn youdo rent movie dumb thing never see,0
low quality,0
frog phone charm adorable eye catching,1
lady table next u find live green caterpillar salad,0
mediocre miserable hollow laughable predictable piece garbage,0
dessert panna cotta amaze,1
chicken get definitely reheat ok wedge cold soggy,0
pretty picture world make piece work flaw core,0
filmiing less expansive,0
thoroughly disappointed,0
two felt disgust,0
fry hot neither burger,0
fun chef,1
think bad,0
definately enjoy,1
cast veteran actor nostalgia trip,1
kathy bates wonderful character subtle desperation escapism variation character play field lord,1
new fav vega buffet spot,1
easy pair samsung cell,1
time bad customer service,0
majority logitech earbud headset fail,0
waste money,0
chinese forgery abound,0
come verizon cingulair nicer cell phone first thing notice really bad service,0
dont think redeeming quality remake,0
time film end dislike despise,0
would recommend place,0
want real scare rent one,1
excellent new restaurant experienced frenchman,1
best headset ever,1
top line dont waste time money one bad come,0
zillion time away reality,0
great touch,1
pretty good product,1
service quick friendly,1
impressed go original battery extended battery,1
spend money elsewhere,0
waitress sweet funny,1
ill take business dinner dollar elsewhere,0
actor truly understand become particular character deliver convincing sincere performance,1
stop place madison ironman friendly kind staff,1
waste money,0
ive miss numerous call reason,0
watch however small consolation actress play anne sister wonderful job role,1
fit palm tungsten break first time try plug,0
awesome service food,1
really find funny,1
never go back place never ever recommend place anyone,0
setup go smoothly,1
funny,1
convenient simple use get job do make car ride much smoother,1
worst ever,0
span hour two people exclaim whoa new phone tv,1
try go lunch madhouse,0
see many movie star jaclyn smith god one best though come year ago,1
place pretty good nice little vibe restaurant,1
boyfriend come first time recent trip vega could pleased quality food service,1
probably wont come back,0
fact stinker smell like directtovideo release,0
recently try caballeros back every week since,1
perform awful muffle tinny incoming sound severe echo end call,0
couldnt figure,0
plot,0
well package arrive time work intend,1
piece crap,0
buyer beware could flush money right toilet,0
bad piece crap ever along verizon customer service,0
dont know exactly movie latch endear movie become special part family memory,1
also phone drop case go save specially drop face,0
let girlfriend talk see bad idea hat,0
assure wont disappoint,1
dont waste money time,0
item receive counterfeit,0
would avoid place stay mirage,0
none three size send headset would stay ear,0
would recommend others,0
courtroom drama compelling indictment american justice system frightening,1
cast good,1
wasnt busy either also building freeze cold,0
awful,0
doesnt last long,0
sure beat nacho movie would expect little bit come restaurant,0
character onedimensional even good guy especially bad guy,0
blue ant easy use,1
didnt know pull pork could soooo delicious,1
final word show real torture,0
recommend confidence,1
originality freshness first movie spend remake little else offer,0
buy want use holster,0
perhaps catch night judging review im inspire go back,0
saw film christmas great film,1
jerk phone,0
love cable allow connect miniusb device pc,1
place horrible way overprice,0
watch price inflate portion get small management attitude grow rapidly,0
today second time ive lunch buffet pretty good,1
masterful piece filmmaking many theme simmer occasionally boil wart study poet bohemian selfindulgent wartime year span aerial bombardment london outward tranquillity welsh coastal retreat borderline friendship lust love dedication art experience versus practical concern jealousy rivalry cowardice egotism versus heroism selfsacrifice,1
stay away store careful,0
open battery connection break device turn,0
amaze quick arrival two original lg cell phone battery fraction price,1
thats huge design flaw unless im use correctly dont think case,0
convention never work well past certainly doesnt work,0
food delicious spicy enough sure ask spicy prefer way,1
interest decor,1
plot doesnt hang together acting absolutely appal,0
good order twice,1
cumbersome design,0
back many time soon,1
absolutel junk,0
really like product motorola allot clearer ear piece mic,1
predictable bad watch,1
welldesigned sharp blue nice color,1
emily watson character strong give quick glance understand everything,1
greedy corporation never see another dime,0
cant wait go back,1
great food great service clean friendly setting,1
great steak great side great wine amazing dessert,1
comfortable ear,1
one favorite purchase ever,1
possible movie get bad,0
consider two u leave full happy cant go wrong,1
food come good pace,1
worth,0
horrendous,0
make strange tick noise end call,0
overall would recommend phone new walkman,1
star,1
base subpar service receive effort show gratitude business wont go back,0
also best cheese crisp town,1
stanwyck morgan perfectly cast many way modern equivalent dickens christmas carol sensibility,1
fit like glove strong secure durable,1
dont miss,1
point friend basically figure place joke didnt mind make publicly loudly know,0
see movie definitely recommend,1
con spotty service,0
cheap plastic creak like old wooden floor,0
mean really get famous fish chip terrible,0
also make easy hold,1
staff spend time talk,0
still set get big oyvey scale,1
good go review place twice hereas tribute place tribute event hold last night,1
movie movie situation beginning game play acting coach fascinate,1
go watch,1
well make easy access phone handy detachable belt clip,1
first visit hiro delight,1
movie pure disaster story stupid editing bad see confuse incredibly,0
definitely come back,1
pleather case doesnt fit,0
hard judge whether side good gross melt styrofoam didnt want eat fear get sick,0
dont waste one,0
pick speed get right point,1
great product price,1
wait hour never get either pizza many around u come later,0
similarly delivery man say word apology food minute late,0
burger arent good pizza use amazing doughy flavorless,0
would recommend item anyone,0
cook perfection service impeccable,1
ive trouble access internet download ringtones perform function,1
ive try several different earpiece cell phone jabra one first one ive find fit ear comfortably,1
even fully charge go bed turn blue tooth wifi notice leave morning,0
call steakhouse cant properly cook steak dont understand,0
overall disappointed quality food bouchon,0
itll regular stop trip phoenix,1
definitely would eat,0
price think place would much rather go,0
ill look new earpiece,0
dont like nokia either,0
pleased headset,1
promptly greet seat,1
work fine motorola cellphone lot good wornout battery,1
nokia usb cable work phone,0
poor quality,0
really good far probably best bt headset ever,1
avoid cost,0
soundtrack wasnt terrible either,1
server fantastic find wife love roast garlic bone marrow add extra meal another marrow go,1
play louder speaker size price low would think quality lack however,1
comfortable hand,1
love sushi find kabuki overprice overhip underservices,0
recently problem could stay connect minute disconnect,0
fast service,1
excellent starter wireless headset,0
nine ten truly lovely film,1
sanyo survive dozen drop blacktop without ill effect,1
battery hold well,1
probably hurry go back,0
go since every meal awesome,1
could use exemplar set designer,1
great atmosphere friendly fast service,1
first bathroom location dirty seat cover replenish plain yucky,0
good expect,1
whine internet goesthe use thing less like,0
rare filmmaker take time tell worthy moral tale care love doesnt fall trap overly syrupy indulgent,1
great phone,1
service suck,0
dialogue compose thing make little sense,0
im az time new spot,1
get small adorable,1
beware,0
turkey roast beef bland,0
one big drawback player button phone front cover let pause skip song lock second,0
barely ever hear constantly say,0
best charger see market yet,1
everything movie stupid,0
movie boring sometimes find occupy peak paper instead watch never happen columbo movie,0
worth check,1
every single character hilarious deserve call lead,1
role play well,1
place deserve one star food,0
julian fellowes triumph,1
script big flawed mess,0
case would order another,1
wont ever go,0
use slowmotion needlessly repeat throughout movie well back bad acting bad kind word continuity scenes throw reason whatsoever vehicle look like make corn flake box directorial style border stupidity,0
great food awesome service,1
however pretty good act least type film,1
set especially design work camera amazingstylized beautiful effective,1
didnt charge,0
pda rock,1
boring,0
problem others mention,0
easy watch,0
service par either,0
delete film mind,0
easy use,1
could barely stomach meal didnt complain business lunch,0
wait hour breakfast could do time well home,0
great phone,1
reflect cast also belowpar script borrow much early classic,0
think robert ryans best film portray someone like father schizophrenic real lifemy father although never murder anyone affect second world war make worse,1
lovely little thriller hitchcock lot nice shenanigan surround murder spy kidnap child nasty church foreign plot random taxidermist,1
excellent sound battery life inconspicuous boot,1
price amazon excellent product would highly recommend,1
particularly remember sens assault strident cord music would blare little warning even less mean,0
