processed_sentence,sentiment
also notable john bailey fine crisp beautifully color cinematography great production design costume eiko ishioka go memorable costume coppola dracula receive well deserve oscar,1
drain,0
place honestly blow,0
buck head really expect good food,0
start tuna sashimi brownish color obviously wasnt fresh,0
say film excellently produce top rating typical sci fi film,1
service excellent price pretty reasonable consider vegas locate inside crystal shop mall aria,1
bit sweet really spicy enough lack flavor,0
receive order well within shipping timeframe everything good working order overall excited source,1
great price also,1
case ive try normally fall apart month one seem long haul,1
click place way make wonder long mechanism would last,0
technically film well make impressive camerawork solid acting effective music riz ortolani particularly good recur unaccompanied female vocal sound like come distant hill,1
never condescend character good genuine heart believable problem,1
say,0
lange become great actress,1
great food service huge portion give military discount,1
love headset,1
excellent service,1
highly unprofessional rude loyal patron,0
get absolutely horrible reception apartment phone problem,0
bar vega ever recall charge tap water,0
like armand assante cable company summary sound interest watch twice already probably,1
know emilio estevezs directorial debut pace interplay development character well clever camera work surround character estevez play suggest natural eye,1
im still infatuate phone,1
wasnt busy know,0
would highly recommend,1
cant use case smell disgust,0
sorry make purchase,0
greatno problem,1
food gooodd,1
onscreen chemistry critical entire film genuine,1
everything appal,0
buy nokia cell phone week ago nightmare,0
stupid,0
there horrible tick sound background call never experience,0
highly recommend one blue tooth phone,1
movie awesome,1
protect phone side,1
pay bill tip felt server terrible job,0
excellent restaurant highlight great service unique menu beautiful setting,1
waste time,0
place like chipotle good,1
first think grtting good deal plug phone razr,0
act involve include like shatner nimoy bad wash make seem old look real life special effect tacky like spock rescue kirk jet pack fall mountain,0
pleasant voyage selfdiscovery,0
month worked flawlessly far,1
would recommend save room,1
definitely back,1
way plug u unless go converter,0
movie cut edge,1
bluetooth range good day ago leave phone trunk get call carry conversation without hitch,1
love really scary,1
look movie terrific cast good musicincluding shirley jones rendition way look tonight uplifting end give one try,1
motorola finally get voice quality bluetooth headset right,1
long time since entertain movie,1
aggravating,0
talk great customer service course back,1
dont think ill run back carlys anytime soon food,0
order voodoo pasta first time id really excellent pasta since go gluten free several year ago,1
nacho must,1
food average best,0
know jim oconnor energetic nobody could much george well dull,0
great audio,1
mac salad pretty bland get,0
battery excellent bargain,1
pretty gross,0
steak well trim also perfectly cook,1
phone fast send kind message web browsing significantly faster previous phone use,1
service fine waitress friendly,1
small sleek impressive look practical setup ample storage place,1
summer dine charming outdoor patio delightful,1
thing happen character personality change plot twist occur real reason script call,0
fit ear well comfortable,1
get ta love closeup slimy drool teeth,1
highly recommend modest price cellular phone,1
think,0
menu always change food quality go service extremely slow,0
piece junk,0
cant upload ringtones third party,0
one bad show time,0
wind completely useless,0
pizza good peanut sauce tasty,1
hear im driving car usually dont even put loud setting,1
place first pho amaze,1
search internet find one best value,1
staff great food delish incredible beer selection,1
find cell phone right away enter car,1
everything fine reasonable price ie,1
main thing didnt enjoy crowd old crowd around mid,0
ive never insulted felt disrespect,0
buyerbe careful,0
also slim enough fit alarm clock dock station without remove case,1
care consumer one bit,0
feel comfortable headset wear glass get way sometimes,1
tragedy struck,0
like building use couple location maybe poor hummh,0
love great armband,1
chicken dish ok beef like shoe leather,0
bad experience,0
great movie,1
button bad,0
live music friday totally blow,0
overall great experience,1
hole wall great mexican street taco friendly staff,1
perabo nice energy level obviously comfortable front camera,1
ring toneoverall good phone buy,1
story line awful,0
im sorry really cant recommend anyone,0
dont afraid subtitle worth little aversion therapy,1
bad phone ive ever month,0
great sound service,1
everything,1
receive supposedly new motorola apparently match phone charger,0
worst customer service,0
summarize food incredible nay transcendant nothing brings joy quite like memory pneumatic condiment dispenser,1
buy save alot money,1
think plan onethis sure last moto phone,0
excellent short film,1
iam pleased purchase,1
need least min get phone book time first turn phonebattery life short,0
want,1
buy mother problem battery,0
piece junk break phone day,0
thing four kid get absolutely hilarious watch,1
work great,1
like steiner dark feel like bar,1
generally lack imagination,0
battery life highly unacceptable,0
even bad ticker,0
want money back,0
best fish ive ever life,1
loud enough doesnt turn like,0
whatever prompt documentary beyond,0
like fact rest lightly ear rather inside,1
however paul schrader indeed make film mishima superb complex,1
red curry much bamboo shoot wasnt tasty,0
minute wait salad realize wasnt come time soon,0
love thing,1
walk away stuff happy first vega buffet experience,1
answer call unit never work,0
hate disagree fellow yelpers husband disappointed place,0
last time lunch bad,0
character flesh surprisingly well particularly grime blake actor deliver sharply script line right amount deadpan tongue cheek make dialogue hilarious realistic,1
way fried,0
didnt work people hear talk,0
always pleasure deal,1
would take long describe bad customer service experience amazon,0
pack,0
food isnt bad enough enjoy deal world worstannoying drunk people,0
appear actually outperform original battery china come,1
clip belt deffinitely make feel like cent upandcoming,1
pay much,0
echo problemvery unsatisfactory,0
company ship product promptly work well,1
film nothing pretext show ridiculous action scene,0
item match picture,0
want wait mediocre food downright terrible service place,0
show exactly government scientist argue humanity reason gadget,1
pleased see could replace well travled swivel holster blackberry flip,1
fly apple juice fly,0
jawbone era awesome,1
leather nice soft fit tight cut face good shape,1
complaint standard sound volume little low even turn,0
miss wish one philadelphia,1
kris kristoffersen good movie really make difference,1
satisfied cell phone day one,1
charger work week completely stop charge phone,0
story powerful exploration nature man art,1
seriously killer hot chai latte,1
server pleasant deal dont always honor pizza hut coupon,0
restaurant atmosphere exquisite,1
rickman stowe play role hilt tale childrens book writer maybe write subversive tract,1
good commentary today love undoubtedly film worth see,1
love biscuit,1
easy turn car volume control quite accessable,1
prompt service,1
unfortunately must hit bakery leftover day everything order stale,0
isnt small family restaurant fine dining establishment,1
waitress friendly,1
star brick oven bread app,1
rat,0
movie excellent job reveal complexity task incredible challenge face south africa,1
light plenty battery capacity confortable wear somewhat extended period time,1
give try eat crust teeth still sore,0
sweet potato tot good onion ring perfection close,1
high hope place since burger cook charcoal grill unfortunately taste fell flat way flat,0
could understand kind idiot would produce mess first place mention several season,0
place nice surprise,1
mostly routine factbased tv drama get boost fine performance cole,1
would give television series plus could,1
shrimp unwrap live mile brushfire literally ice cold,0
charge cingular att phone,0
film redeeming feature,0
work,1
best taco town far,1
chicken wing contain dry chicken meat ever eat,0
fresh subtle rather sublime effect,1
however finally watch film realize closed mind brilliance depict also find watch,1
stay vega must get breakfast least,1
bethe audio quality poor,0
feature outlandish array memorable psychotic lovable nut,1
chow mein good,1
love lane ive never see movie lousy,0
hackneyed write certainly make even bad bad directing,0
holster arrive match photo ad,0
wont say dont like spoiler dont want one believe film worth time,1
favorite place town shawarrrrrrma,1
try airport experience tasty food speedy friendly service,1
product excellent work well verizon one boy cheap,1
phone take forever charge like hour literally,0
jimmy stewart ever great hero hitchcock story rip along cool climax embassy function lack brood menace hitchcock black white lowbudget original,1
design odd ear clip comfortable,0
kid pizza always hit lot great side dish option kiddos,1
love fry bean,1
look nice,1
seller ship quickly much cheap competitor,1
nice headset price right,1
casting also horrible cause see really really bad actor period,0
mic joke volume quite low,0
gloriously fun fast paced fairly accurate portrayal night raver,1
however decent act action location work balance thing,0
pretty satifying experience,1
love phone handy lot feature,1
cashier care ever say still end wayyy overprice,0
dont,0
cast great,1
terrible service,0
wear glass fit fine,1
item arrive quickly work great metro pc samsung slider phone sony premium sound ear plug,1
inside really quite nice clean,1
item fantastic work perfectly,1
work great,1
average acting main person low budget clearly see,0
cool,1
nothing privileged workingeating,0
google mediocre imagine smashburger pop,0
dont know slow,0
check,1
im probably one people ever go ians like,0
food really boring,0
total waste time,0
love phone,1
put race card aside let look major flaw film destroy latifas character,0
block amaze,1
truly truly bad film,0
finally get end wouldve great handle competent people jerry falwell,0
bad film bad writing good actorsan ugly cartoon craft paul haggis people cant handle anything bold stroke storytellinga picture paint crayon,0
waste money time,0
refuse refund replace,0
point finger item menu order wont disappoint,1
wont go back,0
one boringpointless movie ever see,0
practically perfect true masterpiece sea faux masterpiece,1
keep get good well third one ive numerous palm,1
bread make inhouse,1
get incredibly fresh fish prepare care,1
wasnt watch film realise great actually,1
microphone also work well accord people call applifies everything,1
camera although rat impressive megapixels render image fall well expectation relatively high resolution,0
dit work time nokia,0
vomit bathroom mid lunch,0
stop late may bank holiday rick steve recommendation love,1
lastly mozzarella stick best thing order,1
much less jawbone go replace,1
bad purchase,0
unfortunately recharge iphone despite connect multiple power source imac external battery wall outlet etc,0
service give star,0
bother contact company dollar product learn lesson buy form online anyway,0
simply beautiful,1
predictable even chick flick,0
excellently produce one scifis best producer scot vandiver,1
great charger,1
happy product,1
actor give wonderful performance especially jennifer rubin jamie harris change nervous starlet beginning strange event part cool star,1
half way film start dislike,0
overall film interesting thoughtprovoking,1
cant believe there even sequel,0
always evening wonderful food delicious,1
potato great biscuit,1
find good movie youtube,0
killer dont expect anything original even remotely frighten,0
tom wilkinson character man prepare ordeal begin take matter hand story progress great actor give performance make feel character anguish suffer,1
tonight elk filet specialand suck,0
disappointed,0
sound clear people talk amaze quality,1
delicious,1
directing sloppy best,0
angus scrimm also turn good performance somewhat brief memorable role gently menace violinplaying anatomist doctor quinn,1
really vegas fine dining use right menu hand lady price list,1
second appearance mickey mouse follow silent plane crazy earlier year probably famous filmmostly groundbreaking,1
tiny toon keep vibe deliver one popular funny underrated cartoon ever create,1
never ever go back tell many people happen,0
telephone repair man really funny reaction nut bitchy bos truly genuine,1
good protection make phone bulky,1
youd iq particularly stupid mollusk see one come,0
accompanied software almost brilliant,1
isnt even achievement sobaditsgood sobaditsmemorable movie,0
rock world certainly must see anyone social physical outlet,1
work,0
european movie nice throwback time student experience live abroad interact nationality although circumstance slightly different,1
unfortunately virtue films production work lose regrettable script,0
service great even manager come help table,1
pretty awesome place,1
receive headset good time happy,1
later find lose power film,1
much good food vega feel cheat waste eat opportunity go rice company,0
minute wait get table,0
get pay guess,0
use two day wasnt always easy hear,0
addition feel amp look phone lightweight cheap plastic,0
much flavor poorly construct,0
design might ergonomic theory could stand ear,0
product great make work lot easy go copier wait hold something,1
cool phone,1
reception poor,0
one place phoenix would definately go back,1
also serve indian naan bread hummus spicy pine nut sauce world,1
attractive appear good quality,1
quit work id use month purchase another one best headset ive ever own,1
seat immediately,1
dont much pasta love homemade hand make pasta thin pizza,1
really love story line poler bear kinda cutebut anyone question fort steele ask away,1
work like charm work one get phone,1
bad actually worth see reason,0
maybe vegetarian fare ive twice think average best,0
deal good enough would drag establishment,0
damian talented versatile many way writing portray different character screen,1
excellent product price,1
happy,1
success film depend casting sydney greenstreet alexander yardley character,1
lunch great experience,1
also decide send back waitress look like verge heart attack,0
happen next prettyoff put,0
service friendly invite,1
completely gross,0
han nan chicken also tasty,1
disappointing experience,0
result film dont look right,0
ive also problem phone read memory card always turn,0
utterly without merit level akin torture,0
plan order,1
sometimes embarrassing look away,0
server nice attentive serving staff,1
fan genre heaven,1
director neil labute us brutal violence seperate dream reality along touching drama hilarious comedy never tell go happen next,1
chef friendly good job,1
bad software ever use could give zero star would,0
plus movie rather modest budget fast running time amazing job,1
sergeant pepper beef sandwich auju sauce excellent sandwich well,1
pan cake everyone rave taste like sugary disaster tailor palate six year old,0
first time cant wait next,1
good wear hat sunglass,0
bad everyone else involve didnt share crowes level dedication quality wed far good film hand subpar mess,0
disappointing,0
work cell phone plug set charger,0
mega pixel camera part phone reasonably,1
know make wise decision,1
sure order dessert even need pack togo tiramisu cannoli die,1
lame would best way describe,0
overall dont think would take parent place make similar complaint silently felt,0
fantastic service,1
five star plus plus,1
could get strong enough signal,0
unless youre visually collect extant film austen work skip one,0
do second movie,0
really hope team behind movie make movie continue kinda weird style,1
manna heaven terrific film predictable unpredictable time,1
kind hard mess steak,0
good quality bargain buy buy cheapy big lot sound awful people end couldnt hear,1
seller understanding patient would definitely buy,1
adorable see mickey play turkey straw highly imaginative occasionally cruel way,1
speaking music unbearably predictably kitchy,0
omelet die,1
think acting skilled,1
year however remind u huston still top game evince faithful adaptation james joyce acclaim novella dead,1
understated film leave lasting impression,1
good film indeed great unconditional love,1
choice headset yearsgreat sound good volume good noise cancellation,1
eew location need complete overhaul,0
thing go wrong burn saganaki,0
early film future goremeister lucio fulci good addition giallo subgenre,1
really fantastic thai restaurant definitely worth visit,1
visual effect awful,0
dont accountant know im get screw,0
lately extremely nice helpful phone,1
product exactly described,1
surely doesnt know make coherent action movie screenwriter air force one oblige write script big sum money,0
certainly comfortable functionality decent,1
seasonal fruit fresh white peach puree,1
perhaps phone defective people hear use,0
hand best phone ive ever,1
sound quality end excellent use headset call wife ask wife use headset call,1
make story different terrific production value faultless photography composition edit terrific cast underappreciated brian keith play bully teddy vivid history,1
opportunity today sample amazing pizza,1
totally absolutely recommend movie anyone like good wholesome family movie exactly,1
waste money,0
wear everyday hold well,1
dont buy,0
several time past experience always great,1
bland liking place number reason dont want waste time bad review ill leave,0
generally line plot weak average episode,0
see probably leave shelf,0
fantastic neighborhood gem,1
work,0
setup couldnt simpler,1
prosgood camera nice picture also cool style like black white,1
device great several,1
wife lobster bisque soup lukewarm,0
additional ear gel provide instruction whatsoever,0
im please,1
kid play area nasty,0
plot storyline,0
jabra earset happy sound quality especially outgo well,1
present idyllic yet serious portrayal ups down character life,1
wont work right atleast,0
love ringtones upbeat,1
great way finish great,1
understand suppose cheap popcorn comedy doesnt mean completely insult intelligence write incredibly hackneyed border offensive,0
try cape cod ravoli chickenwith cranberrymmmm,1
menu diverse reasonably price,1
fact im go round star awesome,1
hour half waste time follow bunch pretty high schoolers whine cry life,0
think youd venture away get good sushi place really hit spot night,1
utter crap sound quality terrible,0
arent one make scene restaurant dont get itdefinitely lose love one,0
omg food delicioso,1
trumbull love lucy,1
interesting part town place amaze,1
consider excellent story solid acting look film added bonus,1
service super friendly,1
buy hop could make bluetooth headset fit well thing make impossible wear,0
phone hold charge like new,1
incredible,1
reception headset excellent,1
group claim would handle u beautifully,1
awful,0
item state include description include,0
enjoy pizza brunch,1
great camera thats pic nice clear great picture quality,1
ripped banana rip petrified tasteless,0
truly art movieit actually lot art,1
thats rightthe red velvet cakeohhh stuff good,1
little geeky think thats sex toast rock ooze sex right battery embed sleek stylish leather case,1
shrimp tender moist,1
chain im fan beat place easily,0
camera color balance awful,0
would definitely recommend wing well pizza,1
work good,1
third cheese friend burger cold,0
couldnt use unit sunglass good texas,0
veggitarian platter world,1
huge awkward piece cow gristle fat,0
work well,1
usually dont like headband one lightweight doesnt mess hair,1
omg felt like never eat thai food dish,1
find inexcusable probably return phone perhaps change carrier,0
also taste mom multigrain pumpkin pancake pecan butter amaze fluffy delicious,1
everything act cinematography solid,1
day later puff smoke come phone use,0
would definitely recommend jabra look comfort clarity great price,1
arrive quickly much less expensive others sell,1
magical help,1
hat,0
new battery work great phone,1
hop,0
crouton also taste homemade extra plus,1
ambiance isnt much well,0
believe screenwriter good job tie loose end,1
bad character bad story bad acting,0
doesnt job,0
friend pasta also bad barely touch,0
howeverthe riingtones best neither game,0
staff great ambiance great,1
horrible horrible protector,0
food good enjoy every mouthful enjoyable relaxed venue couple small family group etc,1
garbo show right bat talent could carry silent era want see silent work netflix doesnt seem stock,1
little device transform organizational capability make life whole lot easy,1
would highly recommend product,1
place receive star appetizer,1
start review two star im edit give one,0
particularly pleased act ability dwight schultz,1
know give,1
lot hole plot theres nothing become emperor nothing spend year childhood mature age,0
receive use product day break,0
manage bend leaf spring back place metal enough stress break next drop,0
special thanks dylan recommendation order yummy tummy,1
earbud piece break easily,0
perfect someone like beer ice cold case even colder,1
leave theater lilt step joy heart hope human race,1
simply excuse something poorly do,0
order,1
convenient since stay mgm,1
everything bad,0
overprice get,0
yet plantronincs continue use flawed charger design,0
excellent sound quality,1
say food amaze,1
edit editing film phenomenal opinion,1
stupid keep buy new charger car charger cradle headphone car kit every time new phone come,0
unbelievable bargain,1
fit,0
spicy enough perfect actually,1
classywarm atmosphere fun fresh appetizer succulent steak baseball steak,1
keep watch,1
good,0
toro tartare cavier extraordinary like thinly sliced wagyu white truffle,1
cashier friendly even bring food,1
nice relax late night view,1
bad thai ever,0
much good ayce sushi place go vega,1
first glance lovely bakery cafe nice ambiance clean friendly staff,1
speaker low quality make ring tone sound cheap,0
even hello right,0
downside service,0
impressed job motorola sturdiness phone,1
never walk movie faster,0
actually smart movie,1
connect wife bluetoothmotorola phone work like charm whether phone pocket case,1
bartender also nice,1
still make super end depict great sea vessel take mighty frost,1
great use home stereo,1
displeased,0
work described,1
movie litter overt racial slur towards black cast member return white depict moron boob,0
fit comfortably come three size earbud tip,1
great music terrific scenery,1
item great installed let charge overnite work good every since problem,1
color even pretty think would graphic incredibly sharp,1
loose connection phone even within couple foot two,0
price reasonable service great,1
sangria half glass wine full ridiculous,0
product strong rubberpetroleum smell unbearable cause return,0
still wild stuff though highly recommend fan giallo cinema,1
would reccommend,0
work great,1
enjoyment get see run around play game dangerous,1
would advise purchase item never work well,0
service beyond bad,0
delicious absolutely back,1
get phone reccomendation relative im glad,1
one fail create real suspense,0
bt headset disapoinment,0
love bluetooth,1
never bring salad ask,0
seriously believe owner many unexperienced employee run around like chicken head cut,0
rave review couldnt wait eat herewhat disappointment,0
fabulous,1
seem like good quick place grab bite familiar pub food favor look elsewhere,0
think restaurant suffers try hard enough,0
plot keep go first place,0
service bit lack,0
cant tell disappointed,0
freeze,0
work great car charger especially plug two adapter time,1
im quite satisfied purchase,1
saw movie today think good effort good message kid,1
satisifed,1
extremely rude really many restaurant would love dine weekend vega,0
worst customer service ever,0
bluetooth work phone lock screen flash make call randomly pocket lock,0
there also enough hypocrisy film make vomit,0
excellent,1
lassie movie put sleep forever,0
really like crepe station,1
table service pretty fast,1
art style appearance crayonpencil drawing wonderfully colorful fanciful,1
also combo like burger fry beer decent deal,1
phone get year old slowly break despite much care part,0
piece trash ever release beyond act story character supposedly special effect etcits wrong,0
excellent dualpurpose headset,1
good stretch imagination,0
buy buyit suck,0
think wonderful part literally full wonder excerpt work,1
due fact take minute acknowledge another minute get foodand keep forget thing,0
purchase family friend enjoy clarity ease use,1
different cut piece day still wonderful tender well well flavored,1
delicious nyc bagel good selection cream cheese real lox caper even,1
want sandwich go firehouse,1
omit watch,0
real sushi lover let honest yama good,0
tired clichés lazy writing come thick fast,0
pancake also really good pretty large,1
seafood fresh generous portion,1
good quality,1
buy different phone,0
absolutley fantastic,1
good case,1
worth drive,1
meredith good right,1
id say would hard decision honestly m dish taste suppose taste amaze,1
selection probably bad ive see vegasthere none,0
didnt want clip go top ear causing discomfort,0
daily special always hit group,1
disappointed,0
movie interesting begin end,1
ive well dedicate boba tea spot even jenni pho,0
yes bad,0
ear bud play music one ear,0
would recommend purchase jabra series work flawlessly moto go figure,1
thing disappoint infra red port irda,0
result well shame,0
also feel like chip buy make house,0
atmosphere fun,1
maybe werent cold would somewhat edible,0
film look cheap bland,0
acting help writing along well maybe idiotsavant sister could play well real joy watch,1
dress treat rudely,0
