processed_sentence,sentiment
dont trust website dont expect helpful support,0
film terrible credit version watchable,0
really recommend place go wrong donut place,1
memory murky say enjoy every single episode product relate show,1
headset work great package nicely avoid damage,1
noise shield incrediable,1
take min get milkshake nothing chocolate milk,0
movie possibly one creative work horror ever,1
might get defect would risk buy built quality alone,0
unfortunately work,0
close house lowkey nonfancy affordable price good food,1
track command sentiment actually contribute scene character,1
restore phone like new performance,1
everything description say would,1
look good quality motorola headset keep look isnt,0
first enough racial stereotype racial joke offend everyone,0
mortify,0
wonton thin thick chewy almost melt mouth,1
great place fo take eat,1
youll love thin,1
superb,1
act film glad youre gon na drift away earth far possible,0
usable keyboard actually turn pda realworld useful machine instead neat gadget,1
well never go,0
food way overpriced portion fuck small,0
love look feel samsung flipphones,1
brother law work mall ate day guess sick night,0
recommend igo anyone different brand cell player family,1
gosh best phone ever,1
ask bill leave without eat didnt bring either,0
dont make mistake,0
waitress little slow service,0
great phone,1
reception generally good,1
food arrive quickly,1
like loud buzzing override conversation phone,0
guess like detail dysfunctionhe believable,1
far bad purchase ive make amazon,0
bad reception,0
essentially forget microsofts tech support,0
meat pretty dry slice brisket pull pork,0
din space tiny elegantly decorate comfortable,1
even take self portrait outside exterior display cool,1
avoid establishment,0
best place go tasty bowl pho,1
brilliance indeed,1
highly recommend,1
battery unreliable well service use antena,0
premise film ridiculous president u,0
network coverage los angeles horrible,0
exceptionally bad,0
think good investment,1
unfortunately cover girl example hollywood use exploit woman financial gain,0
overall psyched phone appointment contact get great reception,1
although much like look sound place actual experience bit disappointing,0
reception terrible full static,0
portable work,1
recommend friends,1
bela lugosi totally extraneous intone odd line,0
say dessert yummy,1
razr battery good buy,1
assure ill back,1
hear garbage audio,0
order duck rare pink tender inside nice char outside,1
pull car wait another minute acknowledge,0
never ever go back,0
love grilled pizza remind legit italian pizza,1
yes shiny front side love,1
continue come lady night andddd date night highly recommend place anyone area,1
film sole bright spot jonah hill look almost unrecognizable fan recent superbad due amount weight lose interim,1
piece trash,0
everything fresh delicious,1
lucy bell much high crap sink low quite depressing,0
integrate seamlessly motorola razr phone,1
good item low price,1
mature subtle script suggest occasionally bring dramatic focus underlying tension well serve perfect performance apart odd inappropriate smile keira knightley prone though perhaps direction time character often mention,1
explosion gas tank end awful,0
dont waste time,0
constantine give everything right intensity seem good understanding underlying psychological motivation,1
reception excellent,1
go motorolas website follow direction could get pair,0
food arrive meh,0
chemistry ben affleck sandra bullock film couldnt understand would consider even leave wifetobe chick supposedly knock,0
today first taste buldogis gourmet hot dog tell ever think possible,1
product ideal people like whose ear sensitive,1
plug wrong size,0
movie good humorous comment life,1
receive quickly work great,1
good enough price,0
nice design quality,1
id advise anyone go see,1
need two hand operate screenthis software interface decade old compete new software design,0
thumb seller,1
believe pitch black do well,1
place fairly clean food simply wasnt worth,0
single employee come see ok even need water refill finally serve u food,0
sad,0
dissapointing performance,0
month screen go black sudden,0
love fact everything menu worth,1
one didnt work either,0
music film really nice,1
awesome new look fall,1
food terrible,0
save money ive item month,0
love ownerchef one authentic japanese cool dude,1
director paul matthew also wrotedirected weak monster movie grim clearly doesnt know pace film,0
service perfect family atmosphere nice see,1
disgust pretty sure human hair,0
case bad laughable,0
order lemon raspberry ice cocktail also incredible,1
would recommend item,1
short monumental waste time energy would recommend anyone ever see film,0
plus buck,1
warranty problem reoccurebottom line put money somewhere else cingular support,0
doesnt hold charge,0
every time eat see care teamwork professional degree,1
ambiance incredible,1
must night place,0
show make american stupid full hatred clichés admit elsewhere,0
crêpe delicate thin moist,1
friend like bloody mary,0
service quick even go order like like,1
love place hit spot want something healthy lack quantity flavor,1
get food apparently never hear salt batter fish chewy,0
drive bark mad,0
also great see renowned silent screenwriter france marion hasnt miss step go silent sound,1
happy product,1
staff friendly joint always clean,1
ive good bagel grocery store,0
guy say he well dialogue potted plant right,0
fella get huevos rancheros didnt look appeal,0
continuously beautiful look bertolucci relationship convincing narrative engaging master work,1
everything product wrongfirst,0
know sound funny seem like sketchy technology wouldnt work wellwell one work great,1
research development division obviously know theyre,1
popular cinema good house good reaction plenty laugh,1
cant relate hell barely understand,0
uneasy bad movie scar,0
awkward use unreliable,0
poor quality service,0
server suck wait correction server heimer suck,0
crust good,0
recognize phone storage device,0
world well garbage theatre today,1
great double cheeseburger,1
initially local site film film buffalo intrigue,1
thus far visit twice food absolutely delicious time,1
make sturdy,1
two year leave contract hate phone,0
extraordinary film,1
share general loewenhielms exquisite joy partaking cailles en sarcophage even though watch movie wish small sample savor,1
great choice,1
however bt headset currently good real time game like firstperson shooter since audio delay mess,0
early review note plug charger nothing happens,0
see,1
warm beer didnt help,0
one want surf small wave space movie deep impact armageddon one fail everywhere,0
try cable computer ipod work fine,1
italian reviewer call small great film thats right,1
watch wash machine twirl around wouldnt hurt eye much show,0
shift bubble peel even scratch nothingi couldnt happy new one droid,1
even allow poor production value time format kind miniseries baaaaaad,0
ill give film,1
probably wont back honest,0
doesnt work bougth work,0
disbelief dish qualify bad version food ever taste,0
definitely bargain,1
pricing bit concern mellow mushroom,0
server great job handle large rowdy table,1
kind embarrass use look mostly embarrass childlike company,0
decor nice piano music soundtrack pleasant,1
experience terrible fourth bluetooth headset much comfortable last jabra hat,0
plethora salad sandwich everything ive tried get seal approval,1
drink weak people,0
restaurant clean family restaurant feel,1
battery junk,0
take battery phone put back together restart,0
four star food guy blue shirt great vibe still let u eat,1
work great cat attack phone scratch protective strip instead destroy screen,1
whole experience underwhelming think well go ninja sushi next time,0
work fine,1
good plot hold complete attention acting superb tom wilkinson fantastic emily watson also good,1
potato chip order sad could probably count many chip box probably around,0
virgin wireless rock cheap little phone,1
join club get awesome offer via email,1
contact company tell although unit still warranty couldnt produce receipt luck,0
hour seriously,0
total package,1
love movie great portrayal family share ups end know special love,1
interesting premise billy drago always good dangerous nutbag side note id love see drago stephen mchattie lance hendrikson flick together talk rag cheekbone,1
interplay martin emilio contain wonderful chemistry saw wall street martin charlie,1
im happy,1
bland flavorless good way describe barely tepid meat,0
suck stuff work phone,0
keep good work amazon,1
plot derivative predictable end like mercy kill,0
maybe would reasonable explanation atrocity,0
instruction didnt explain microphone jack could use,0
however year fliptop start get loose wobbly eventually screen go black couldnt receive place call,0
im really disappointed charger doesnt work,0
everything work first trythe device certainly engineer clever way construction feel good,1
add betty white jean smart great cast everyone play part really well,1
havent choke vomit end cheap drama worthless dialogue youve must bore death waste time,0
even good camp value,0
like design look jabra behing ear headset pretty comfortible wear hour day without pain ear,1
ive live since first last time ive stepped foot place,0
read spec alone make say wow,1
well act do tv movie,1
id rather eat airline food seriously,0
opening sequence gem classic cat mouse game follow delight watch,1
side cafe serf really good food,1
dish salmon best great,1
come strong light use light camera shot even flash so signal seriously,1
potato like rubber could tell make ahead time keep warmer,0
waiter wasnt helpful friendly rarely check u,0
obviously terrible customer service get pay,0
good item work start problem auto reverse tape player,0
good year ago,1
food suck expect suck could imagine,0
disappointed,0
god never get minute back,0
result phone either stick max volume mute,0
able voice dial car problem,1
reason eat would fill night binge drinking get carbs stomach,0
poor voice clarity,0
movie almost action scenes little comedy,0
overall impressed would go back,0
dont think well go back anytime soon,0
battery life also great,1
ps scene movie cool central character find room blow,1
mediocre every aspect become dull uninteresting mess one forgettable movie ive see,0
like reviewer say couldnt pay eat place,0
extremely slow take forever anything,0
ill definitely soon,1
would give star able,0
fun experience,1
attempt artiness black white clever camera angle movie disappoint become even ridiculous acting poor plot line almost nonexistent,0
last time buy,0
lame,0
bus boy hand rude,0
none engage excite,0
hate thing much cheap quality black olive,0
still wait im sure item would work well ever recieve,0
big disappointment calendar sync,0
conclusion bother movie volcano los angeles nothing nonsense,0
buy mainly charger break soon purchase,0
guess maybe go night disgraceful,0
,1
lot website rating good phone,1
table outside also dirty lot time worker always friendly helpful menu,0
feelgood film thats felt come cinema,1
writer smack think best actor actress bonus showthese character real,1
grandmother make roasted chicken well one,0
character interesting really care,1
place handsdown one best place eat phoenix metro area,1
wow spicy delicious,1
bad lose heart finish,0
scene debate whether sack trumpeter falsely accuse murder pure horror really stupid,0
work week break,0
worst service boot least worry,0
nice case feel good hand,1
acting like watch wooden puppet move around read book thats bad,0
story beyond stupid,0
try many many handsfree gadget one finally work well,1
thats id describe painfully dreary timewaster film,0
wind lion well write superbly act,1
good bargain,0
glad find place,1
bad day low tolerance rude customer service people job nice polite wash dish otherwise,0
timely shipment quality product,1
piece junk lose call phone,0
check voice mail night keypad backlight turn second first message im lost,0
movie suffer write need suspense,0
great hand free device,1
im bit disappointed,0
also difficult put onid recommend avoid product,0
always know errol flynn brilliant actor dad favourite actor grow watch film child,1
range decent ive able roam around house phone living room receptionsound quality issue,1
service stink,0
first reception suck never bar ever,0
happy far,1
otherwise easy install use clear sound,1
furthermore cant even find hour operation website,0
unfortunately ability actually know receive call rather important feature phone pitiful respect,0
good stuff price,1
movie seem drag hero didnt really work freedom,0
seriously worth waste kid time,0
felt though go ireland absolutely nothing whatsoever,0
unusable moving car freeway speed,0
im terribly disappoint film would receive many award accolade especially far deserving work film,0
waitress friendly happy accomodate veganveggie option,1
right case movie deliver everything almost right face,1
greek dressing creamy flavorful,1
def come back bowl next time,1
host staff lack good word bitch,0
great earpiece,1
service outshine definitely recommend halibut,1
crisp clear,1
great headset impressed,1
want leave,0
great software motorolas,1
sad little vegetable overcook,0
character funny peculiarity true lead character,1
probably dirt,0
child truly enjoy show proudly say enjoy big time even classical wb cartoon,1
rest cast also play well,1
order burger rare come well do,0
pale color instead nice char flavor,0
hell go back,0
lasted one day blow,0
shot southern california desert use patent faux documentary style watkins create film like,1
saw mirrormask last night unsatisfactory experience,0
phone try hard everything fail ability phone,0
none new one ever quite work properly,0
check place couple year ago impressed,0
right mind gon na buy battery,0
one best bar food vega,1
nice spicy tender,1
nothing short magnificent photographycinematography film,1
great ipod,1
real plot,0
movie create universe fascinate every way,1
service terrible food mediocre,0
someone involve know string together narrative,0
first thing happen tracking,0
im glad find product amazon hard find wasnt high price,1
fact like good interview vampire like lestat stuart townsend good cruise attempt,1
pretty cool would say,1
indescribably annoying idiotic show ever see,0
glad purchase,1
love death decay shakespears lyric one,1
way expensive,0
good thing ticket cost five dollar would mad id pay see crap,0
impress product,0
cant beat price,1
price great deal,1
movie excellentangel beautiful scamp adorablehis little yelp he scaredand funny part whenscamp catch curtain angel scamp sing ive never feeling beforei totally recommend movieits come special edition june cover scamp garbage angel underneath lid,1
high adventure best,1
poor remake best friend wed,0
one nice thing add gratuity bill since party large didnt expect tip,1
igo charger tip really great,1
pleased know modern day genius let passion art drive take u audience,1
bad martini ever,0
hayao miyazakis late eighth film studio ghibili gake ue ponyo ponyo cliff sea wonderfully fun imaginative look childhood,1
go rent,1
open sandwich impressed good way,0
unfortunately set u disapppointment entree,0
disappoint accessory good manufacturer,0
duris wholesome appearance give fine performance,1
steve martin deliver really funny performance middleaged upper class uptight white guy,1
directing cinematography arent quite good,0
pair iphone could happy far,1
portion huge,1
juano hernandez exceptional actor play support role many film era proud black man accuse murder white man south,1
voice recognition thru handset excellent,1
great jawbone,1
say bye bye tip lady,0
equally awful,0
overall like place lot,1
film lack convincing script,0
real killer volume course break,0
pairing two device easy barely take couple minute start make call voice dial feature,1
buffet small food offer bland,0
think errol flynn brilliant custer since become favourite actor,1
elias koteasjack palance play good role angelina hot get nakedbilly drago appear cool usual cameo sven ole thorsen help make enjoyable movie good acting decent budget,1
soggy good,0
take picture battery drop bar start beep let know dieing,0
ha long bay bit flop,0
people first timer film making think excellent job,1
post detailed comment grey black phone fire red great color,1
get signal verizon phone wont,1
make call certain place,0
like patio service outstanding,1
also take picture case lense cover,0
waiter attentive friendly informative,1
look sharp screen nice clear great graphic,1
thing think could improve sound leak headset,0
uncomfortable sound quality quite poor compare phone razr previous wired headset plug lg,0
see film,1
great deal,1
best scene movie gerardo try find song keep run head,1
flair bartender absolutely amazing,1
probably would go,0
good joint,1
look like wonderful story,1
one bad film ever see,0
trouble volume,0
great place highly recommend,1
artless camerawork endlessly present u ugly setting imaginable ie,0
send back,0
weird vibe owner,0
battery terrible,0
place great,1
dont buy product,0
warn stay away,0
great film great director,1
bug never show would give sure side wall bug climb kitchen,0
back,0
highquality chicken chicken caesar salad,1
hope place stick around,1
ill even say torture,0
would come back sushi craving vega,1
didnt make scared horrify make sympathetic towards character simply annoy,0
use bitpim free program find internetto transfer data phonethe price cable excellent,1
nice leather,1
dont understand garbage get shelf movie store even real movie,0
get inside youll impress place,1
actually turn pretty decent far blist horrorsuspense film go,1
one bite hook,1
clear skype call long battery life long range,1
definitely worth see sort thought provoking film force question threshold loneliness,1
football scene end perplex,0
people like european film art movie like movie,1
phone crash completely get replace,0
didnt realize wonderful short really last two scene,1
poorly contstruct hinge,0
word embarrass,0
shower area outside rinse take full shower unless dont mind nude everyone see,0
though wind lion tell largely eye son every member family identify one character whether sean connerys noble brigand candace bergens feisty heroine john huston wily john hay steve kanalys spiffy radiant ruthless cando lieutenant roosevelt big stick,1
get bored watching jessice lange take clothes,0
could recommend,0
unfortunately inexperience direction meant scene scene pass little way dramatic tension conflict,0
movie edge seat make somewhat afraid go car end night,1
nice blanket moz top feel like do cover subpar food,1
exquisite visual composition moment inventive elegant use closeup camera angle light include pointillistic faux home movie footage wonder joy behold,1
much say place walk expect amaze quickly disappointed,0
cool,1
thing like prime rib dessert section,1
first phone ive cheaply make,0
purchase phone,0
great product sure beat use finger,1
bore,0
overall like food service,1
food rich order accordingly,1
crash depressing little nothing provoke emotion teach nothing already know racism prejudice bad thing,0
everything good tasty,1
cashew cream sauce bland vegetable undercooked,0
work comfortable,1
line seem write fifteen year old though try oh hard sound like fifteen year old would really um know well talk,0
love put food nice plastic container oppose cram little paper takeout box,1
bathroom next door nice,1
could eat bruschetta day devine,1
phone sturdy nokia bar phone,1
campy sort film thats joy watch,1
phone thorn side really abhor,0
find product waaay big,0
chicken deliciously seasoned perfect fry outside moist chicken inside,1
battery work well replacement original come phone year ago,1
every thing phone work perfectly like,1
guy steak steak love son steak best bad place say best steak he ever eat,1
simple use like,1
acting decidely wooden though bad period universal movie,0
chip sals amazing,1
true classic,1
brilliant twist end,1
cable look thin flimsy scary,0
thank waste money,0
last less minute actually try use phonemy wife phone problem,0
cool case open allow screen get scratch,1
really create unique feeling though,1
place worth time let alone vegas,0
believe every one see movie think people outside south africa understand past attempt truth reconciliation process,1
mobile phone tool must,1
pretty piece junk,0
mistake,0
slowmoving aimless movie distressed drifting young man,0
hour half wish could bring back,0
see kid chanceit open amazing dialog far race relation come last year,1
avoid avoid avoid,0
buy phone replacement startac regret since,0
muddy low quality sound casing around wire insert poorly super glue slide,0
would recommend others,1
id like return,0
always great time do gringo,1
good,0
give thumb,0
find move beautiful enjoyable uplifting,1
patio seating comfortable,1
excellent performance,1
point proceeding look remotely like america,0
average phone bad battery life operate weak network,0
excellent performance m,1
waste,0
good lunch spot,1
secondary plot line incomprehensible relation primary plot line mystify,0
deeply impressed character play,1
first movie ive give year,1
sat right time server get go fantastic,1
love able use one headset landline cell,1
never bland food surprise consider article read focus much spice flavor,0
great pocket pc phone combination,1
instead get bore fest whiny spoil brat babysitting,0
love authentic mexican food want whole bunch interest yet delicious meat choose need try place,1
sauce tasteless,0
give star sound quality,1
shouldnt take min pancake egg,0
read others review havent problem,1
fit comfortably either ear sound clear loud charge last couple day,1
case seem well make,1
great item,1
ive drop phone time say even concrete phone still great knock wood,1
disappointed accessoryone,0
wont return,0
description say yum yum sauce another say eel sauce yet another say spicy mayowell none roll sauce,0
rotating beer tap also highlight place,1
wife hat meal coconut shrimp friend really enjoy meal either,0
wait hour seat great mood,0
dont make mistake please dont buy phone,0
fantastic service please atmosphere,1
eat multiple time time food delicious,1
bad choice,0
one movie need see whenever come tvnever mind fact already memorize,1
brilliant,1
aerial scene welldone,1
whatever avoid groove antithesis good human traffic,0
big waste time,0
kind flop around,0
first time ever come amazing experience still tell people awesome duck,1
story also funny poignant time,1
come back cold,0
use small earpiece provide stay pretty well,1
eclectic selection,1
love casting jimmy buffet science teacher,1
cocktail handmade delicious,1
unfortunately good,0
want healthy authentic ethic food try place,1
choose torture disgust piece blatant american propaganda,0
script script,0
lead man charismafree,0
boyfriend try mediterranean chicken salad fell love,1
rating grade note show bad even mother cast pull daughter show,0
sweet phone,1
sit another ten minute finally give leave,0
positive note server attentive provide great service,1
ryans bar definitely one edinburgh establishment wont revisit,0
dont think disappoint,1
nice solid keyboard,1
best service food ever maria server good friendly make day,1
poor batter meat ratio make chicken tender unsatisfying,0
delivery time,1
go give star rating please know third time eat bachi burger write review,0
sprint charge service,0
battery completely useless,0
loudspeaker option great bumper light appeal,0
beautiful styling though,1
macarons insanely good,1
plan use car forget,0
minute footage waste show mediocre elderly actor awkwardly babble overwrought pseudosatanic gibberish corny enough make teen goth blush almost always olde english sometimes latin may may make word,0
like movie like matrix good yet sequel think youll appreciate thought provoke mindblowing experience film give,1
terrible product waste money,0
battery life still long enough motorola razor,0
order appetizer take minute pizza another minute,0
act alongside olivia de havilland brilliant end fantastic,1
movie kind long length enjoy every minute,1
menu much good stuff could decide,1
wish could enter negative value admins,0
someone order two taco dont think may part customer service ask combo ala cart,0
comfortable wear well probably important aspect use case,1
especially love long battery life,1
poor sound quality,0
left frustrated,0
definitely must state allow cell phone usage drive,1
ive bluetooth week really like,1
filmmaker director would hide head sand id spend whatever amount money time movie,0
spaghetti nothing special whatsoever,0
incredible soundtrack truly capture essence film,1
couple month later return amazing meal,1
couldnt take seriously,0
user friendly,0
price reasonable flavor spot sauce home make slaw drench mayo,1
please stay away shrimp stir fry noodle,0
deserve star,1
disappoint,0
wouldnt recommend buying product,0
dont many word say place everything pretty well,1
hate movie like,0
wouldnt see movie free,0
cant get software work computer,0
food outstanding price reasonable,1
authentic leather nice shine comfort recommend case,1
cheap feel look cheap,0
beware trashy cult movie trash period,0
great disappointment,0
full unconvincing cardboard character blandly write edward chodorov also produce surprisingly direct jean negulesco one would expect great deal,0
phone unusable new,0
film use word loosely insult moviegoing public,0
work listen music cingular,0
defective crap,0
film highlight fundamental flaw legal process discover guilt innocence rather present good court,1
get sit fairly fast end wait minute place order another minute food arrive,0
product useless since enough charge current charge cellphone plan use,0
frozen margarita way sugary taste,0
great phone,1
much seafood like string pasta bottom,0
particular model would work motorola smartphone,0
youre familiar check,1
total letdown would much rather go camelback flower shop cartel coffee,0
everything gross,0
