processed_sentence,sentiment
seem completely secure hold belt keep iphone inside,1
volume switch rocket unit destination unknown,0
get home see dry damn wing ever,0
honeslty didnt taste fresh,0
best luck rude noncustomer service focus new management,0
rip charge shipping,0
movie full wonderful dance hence title,1
plastic break really easy clip,0
find six inch long piece wire salsa,0
black eyed pea sweet potato unreal,1
take one drop inch kitchen counter crackedi impressed laugh,0
work perfectly,1
sort pap screen afternoon punish unemployed job,0
phone also take great picture even video clip,1
time seem film animation dominate disneypixars cgi masterpiece refresh comfort know miyazaki still rely traditional handdrawn animation tell charming enchant story,1
problem think actor play villain low rent michael ironside,0
century fox road house quite silly noir implausible unmitigated bore movie,0
drive get,0
nothing believable,0
really nothing postinos hope experience well,0
someone shouldve invent sooner,1
house get dropped coverage upstairs coverage basement,0
say abovepretty useless,0
however see short year amaze timeless film actually,1
also fry without doubt bad fry ive ever,0
work hospitality industry paradise valley refrain recommend cibo long,0
like way dustin hoffman character ready everything stay son,1
wasnt really impressed strip steak,0
obviously problem adhesive,0
disgrace,0
three different occasion ask well do medium well three time get bloody piece meat plate,0
sum film breeder terrible cheaply make horror movie avoid like ebola virus,0
best rotate feature helpful,1
go store buy new nokia phone work great,1
husband say rude even apologize bad food anything,0
however keypad tinny sometimes reach wrong button,0
go first negatively review product,0
cheap hey work pleasantly suprised give low cost item,1
replacement die week,0
purchase within day long work,0
immediately say want talk manager want talk guy shot fireball behind bar,0
yeah movie pretty much suck,0
real disappointment waiter,0
end day one bad bigbudget action movie ive ever see,0
cant explain movie romanticcharminghilariousand adorablethe junkyard scene funnyall junkyard dog something specialtoo funny laughedkids love itbuy come outit new feature,1
ground right next table large smear beensteppedinandtrackedeverywhere pile green bird poop,0
seafood limit boil shrimp crab leg crab legs definitely taste fresh,0
even love bad movie watch movie,0
almost song cover girl oldfashioned tuneful,0
sprint terrible customer service,0
case less extra originally put later discard scratch ear,0
like movie way much,1
food tasty say real traditional hunan style,0
im go eat potato find stranger hair,0
personally think show people learn find compromise self without involve people issue,1
premise sound stupid thats,0
review long overdue since consider tale two sister single greatest film ever make,1
dont know place manage serve bland food ever eat prepare indian cuisine,0
flavorful perfect amount heat,1
really really good rice time,1
painful,0
love device,1
movie terribly bore place,0
reader already see one miyazakis film still top form make another worthwhile experience,1
may bad film ever make,0
thing,0
good food great,1
go far many place ive never see restaurant serve egg breakfast especially,0
there really nothing bad say headset,0
course footage grainy enhance film,1
good phone,1
ive own phone month say best mobile phone ive,1
thumb,1
drain weak snap,0
seriously good pizza im expertconnisseur topic,1
horrible attitude towards customer talk one customer dont enjoy food,0
scenery two daughter paint photograph beautiful,1
cant store anything phone number sim,0
believe actor agree film,0
film lack real scare tension medical terminology use throughout bit iffy say least say insulin dependant diabetic,0
classic maine lobster roll fantastic,1
exchange phone even problem,0
im disappointed decision,0
guess nobody network air dribble watch put,0
lifetime air enough anyone know store sell let know musthave,1
jamaican mojitos delicious,1
clear range ability pull part,1
kid annoy,0
best bluetooth market,1
far best cheesecurds ever,1
pretty easy,1
steer clear product go genuine palm replacementr pen come threepack,0
recommend,0
carry movie well,1
definitely cult classic well worth view share others,1
food barely lukewarm must sit wait server bring u,0
easily none cartoon make laugh tender way get dark sitcom orient teenager,1
otherwise dont even waste time,0
also order spinach avocado salad ingredient sad dressing literally zero taste,0
score mostly plot,1
case pass one year mark show sign wear functional,1
dont think would hold securly belt,0
wow bad film,0
easy use,1
service prompt,1
best electronics available fm transmitter,1
term write fresh bold,1
try make call exercise frustration,0
best buffet town price beat,1
steak amazingrge fillet relleno best seafood plate ever,1
happy,0
phone get buy say wow,1
every element story top excessively phony contrive painful sit,0
mom get home immediately get sick bite salad,0
literally sit minute one ask take order,0
even squibs look awful,0
phone year tell great,0
charming film wonderful sentiment heart,1
id expect good consumer experience motorola,0
uncomfortable ear dont use lg env,0
shameful,0
bottowm lineanother worthless cheap gimmick sprint,0
strawberry tea good,1
acting terrible writing bad,0
jerky camera movement also annoy,0
love bacon wrap date,1
disappointed,0
go see movie bring pillow girlfriendboyfriend keep occupy,0
annoying thing cover girl way rita hayworth put pedestal,0
funny clever hip like prays previous film hype,1
product cost much one expect work far well great ease thing,0
good thing waiter helpful keep bloddy mary come,1
good youd expect,1
plus seriously believe worth steep price point,0
everyone attentive providing excellent customer service,1
phone slim light display beautiful,1
must study anyone interested bad sin industrial design,0
felt light tinny,0
place lot promise fail deliver,0
bad fit way big,0
soyo technology suck,0
bipolarity ruthless thug one minute ruthless killer next minute luvs diaper commercial completely unconvincing,0
none work dont buy,0
avoid cost,0
burger get gold standard burger kind disappointed,0
great bluetooth,1
give,1
directing seem pretentious,0
buyer remorse one,0
ill drivng along headset start ring reason,0
waste little money earpiece,0
sound quality excellent well,1
mention combination pear almond bacon big winner,1
he national treasure,1
fantastic buy get whatever next phone,1
commercial misleading,0
precisely give bad review,0
good show samsung,1
great place couple drink watch sport event wall cover tv,1
lighting awful,0
keep get bad bad im officially do,0
plantronics bluetooth excelent buy,1
okay like consider fair critic ill give credit credit duethe creature effect actually pretty cool,1
allergy warning menu waitress absolutely clue meal contain peanut,0
disappointing dinner go elsewhere dessert,0
id love go back,1
battery chargelife quite long,1
bit predictable,0
best ive found far ive try bluetooths one best quality listener well ease use,1
havent go go,1
lighting dark enough set mood,1
server super nice check u many time,1
essentially communication tool communicate,0
embarassing also ear hurt try push ear plug ear,0
use dirty,0
comfortable nice range good battery life,1
find place accident could happy,1
wed definitely go back,1
original body soul masterpiece,1
food come disappointment ensue,0
nano state itmy son dissapointed,0
spend money time place else,0
oh yeah storyline pathetic,0
get angry want damn pho,0
super charge use small hybrid palmtopcameracellphone excels role,1
anyway think go back,0
great phone,1
hand favorite italian restaurant,1
achille philippa beautifully sing duet giovanni perfectly describe situation movie appreciate subtle layer excellent film,1
food really good get full petty fast,1
punishment park brilliant piece cinema,1
scallop dish quite appal value well,0
really good product,1
sushi strip place go,1
best tater tot southwest,1
get job do,1
movie show lot florida best make look appeal,1
small dont even realize get use,1
great pizza salad,1
wow love place,1
poor service,0
cg open sequence space look like could create microsoft slideshow god sake,0
come back every time im vega,1
script bad bad contain cheesiness unethical joke normally see rated movie,0
extensive menu provide lot option breakfast,1
however need good instruction,0
think film like dream,1
perfect sitdown family meal get together friend,1
first crawfish experience delicious,1
thank great service,1
verizon lg phone work well together good reception range exceed foot line sight,1
still like movie empowerment woman there enough movie like one,1
good price,1
never come,0
battery last hour,0
would recommend,1
cute quaint simple honest,1
nothing authentic place,0
clear quality sound dont mess sound ipod since sound button headset,1
hadnt waste enough life pour salt wound draw time take bring check,0
movie bad,0
exactly want,1
cant go wrong food,1
know make,1
construction headset poor,0
wont try go back even empty,0
much disappoint company,0
back good bbq light fare reasonable pricing tell public back old way,1
star trek final frontier bad series,0
good product incredible value,1
comfortable,1
del taco pretty nasty avoid possible,0
film offer many delight surprise,1
really pleased product far,1
set bad wouldnt look place thunderbird episode,0
never anything complain,1
take back money get outta,0
terrible phone holder,0
one movie never cease interest simply keep alert try attempt decipher meaning,1
side greek salad greek dressing tasty pita hummus refresh,1
order arrive one gyro miss,0
amazon suck,0
problem charge sandwich big subway sub offer good amount vegetable,0
case great work fine,1
dont bother come,0
good job quite amuse,1
story unfolds century jutland use period music play period instrument one fine touch,1
return hour later,0
simply want small flip phone look elsewhere extra bell whistle mediocre,0
ive see soap opera intelligent movie,0
actingeven professional drago debbie rochonwas terrible direct bad perhaps contributory former dialog chimplike camera work barely tolerable,0
display excellent camera good year,1
live neighborhood disappointed wont back convenient location,0
really want make experience good one,1
eargels channel sound directly ear seem increase sound volume clarity,1
also right balance war love,1
come back today since relocate still impressed,0
bacon hella salty,1
im return,0
hold charge long time reasonably comfortable longwearing condition quality sound tremendous,1
film give mean phrase never history human conflict much owe many,1
service leave lot desire,0
pay hot dog fry look like come kid meal wienerschnitzel idea good meal,0
chef generous time even come around twice take picture,1
wont go back,0
ive well atmosphere,0
overall delight,1
mother brother thiswhen saw robert ryan portraying type man good imitation type individual impressed,1
im try return refund,0
love margarita,1
movie definitely average rent,0
even bmw series fairly quiet trouble hear person say,0
disappointing,0
worst hour half lifeoh gosh,0
go back next trip,1
really like,1
good service clean inexpensive boot,1
bathroom clean place well decorate,1
least say act good,0
yet run new battery two bar thats three day without charge,1
could serve vinaigrette may make good overall dish still good,1
logitech bluetooth headset,1
warmth generate contrast austere backdrop,1
watch waiter pay lot attention table ignore u,0
story unbelievable actor,0
food good service good price good,1
order motorola data cable get well finish work product,1
im surprise good quality car charger theres much review,1
awsome device work great,1
krussel always good,1
zero star would give zero star,0
ive nearly year work great,1
best example dumb writing establish turn zombiestudents back human remove necklace contain piece meteorite,0
phone work great,1
none tone acceptable,0
also come back check u regularly excellent service,1
quite comfortable ear,1
horrible dont waste time money,0
please dont waste money,0
bose noise cancelling amaze important nyc commuter,1
owner use work nobu place really similar half price,1
screen size big key pad lit well enough camera quality excellent camera phone,1
good hop,0
doesnt work europe asia,0
extremely crumby pretty tasteless,0
bad experience ever,0
everything need couldnt ask,1
steak recommend,1
send back,0
highlight great quality nigiri,1
service think good,1
terrible car accept cassette,0
item work great break month use,0
exchange sony ericson im pretty happy decision,1
happy wonderful feel good end,1
dont yet hear mickey speak ton sound effect music throughout filmsomething take grant huge crowd pleaser,1
good thing fit comfortably small ear,1
fantastic food,1
really want plantronics right one many issue methe good,0
film ultracheap look,0
get food poisoning buffet,0
problem wit hit drop signal,0
roll eye may stay sure go back try,0
excellent,1
look good picture case huge disappointment,0
leave theater want go dance star,1
story line totally predictable,0
phone get extremely hot,0
great pork sandwich,1
saw short film hbo day absolutely love,1
clever real crowdpleaserthis film still rank among mickey best film even wonderful year,1
love mussel cook wine reduction duck tender potato dish delicious,1
never know push hard enough right number time function want,0
im super pissd,0
wasnt expect oscar material,0
dont know big deal place wont back yaall,0
entire audience applaud conclusion film,1
struggle find anything bad say,1
find movie intelligent even masterful say intelligence imagination obviously use try make sense pitiful attempt human nature try make sense thing,0
excellent product satisfied purchase,1
disappointing,0
avoid one,0
point journey journey touch every member family,1
song best muppets hilarious,1
would recommend,1
service little slow consider serve people server food come slow pace,0
linksys way exchange bad phone refurb unit something,0
first time might last,0
good product well make,1
setting,0
possible way movie could redeem would fodder,0
ear loop need tiny sound great,1
plus wellpaced suit relatively short run time,1
best headset use,1
hold phone particular angle party hear clearly,0
continue pair periodically since somehow keep drop,0
talk useless customer service,0
place,1
imdb rating go low awful time get negative number case,0
one table think food average worth wait,0
even sweet moment,1
guess suppose clever twist shed light situation stupid,0
place treo case snug lot extra room side,0
two seperated mere ft start notice excessive static garble sound headset,0
ive buy wired headphone sound good,0
get good reception clarity phone ive,1
folk otto always make u feel welcome special,1
disappointed wonder could oscar shortlist,0
never get,0
good battery get really fast,1
ribeye steak cook perfectly great mesquite flavor,1
phone sound ok great ok wife phone almost totally unintelligible couldnt understand word say,0
gyro basically lettuce,0
also new problem,0
seriously solid breakfast,1
go happy hour great list wine,1
dessert bit strange,0
verizon tech support walk procedure none work end hard reset wipe data,0
nothing recommend,0
order toasted english muffin come untoasted,0
much hype phone assume best mistake,0
service good company good,1
service exceptional food good review,1
food average,0
brain attempt shutdown part primal impulse selfpreservation,0
weve try like place time think do,0
know like restaurant something,0
always use cord headset freedom wireless helpful,1
damn good steak,1
product clearly ready prime time dont care cool look cant tell call come worthless,0
empty hollow shell movie,0
burger absolutely flavor meat totally bland burger overcook charcoal flavor,0
ursula burton portrayal nun touch funny time make fun nun church,1
say mouth belly still quite pleased,1
winner u,1
dont waste money,0
mic doesnt work,0
end slide edge pant back pocket instead,1
good product good seller,1
mediocre food,0
buffet bellagio far anticipate,0
always cut make beep beep beep sound say signal fail,0
like,0
wont go back anytime soon,0
staff super nice quick even crazy crowd downtown jury lawyer court staff,1
feel poorly construct menu difficult navigate button recessed difficult push,0
buy two neither charge,0
judith light one favorite actress think superb job film,1
wont forget movie,1
complaint,1
even stupid think idea volcano los angeles,0
instant classic great soundtrack catchy song end credit,1
update procedure difficult cumbersome,0
really nice atmosphere,1
customer service terrible,0
place clean food oh stale,0
rating,0
worst phone ever,0
needless say waste money,0
jiggle plug get line right get decent volume,0
make mistake,0
basically service bad,0
really enjoy eating,1
almost everyone involved must return school acting utterly predictable bad script pile garbage round,0
get lot compliment,1
love,1
first charge keep go dead minute,0
outstanding little restaurant best food ever taste,1
get phone around end may im completely unhappy,0
witty delightful adaptation dr seuss book brilliantly animate upas finest thoroughly deserving academy award,1
could take video time quality poor,0
battery work great,1
fat computer geek unbelievable bible thumper badass girl actor,0
horrible,0
worth every penny,1
infuriate,0
dont bother go store,0
use product motor control center lot high voltage hum equipment work great,1
wait wait wait,0
im eat,0
drive thru mean want wait around half hour food somehow end go make u wait wait,0
must say tap episode find watch,1
look authentic thai food go else,0
put late o like slow crawl lock every,0
argue verizon regard dropped call return phone two day,0
phone sturdy waterproof,1
grilled chicken tender yellow saffron seasoning,1
warn buy,0
try unit fail within month pro,0
finally three four time spring latch break could use longer visor,0
movie make sick watch slacker make excuse stupid action minute,0
ear occupy background distract,1
adapter provide enough charge current,0
love itfriendly server great food wonderful imaginative menu,1
sound quality good functionality awesome,1
aside terrible lead film load debit,0
product high quality chinese crap,0
film drop ball,0
wonderful experience make place muststop whenever town,1
show would begin smart as ed comment would totally wall uncalled,0
service fantastic,1
work well,1
pathetic attempt give character depth didnt really work rest plot,0
come run u realize husband leave sunglass table,1
happy item,0
probably never come back wouldnt recommend,0
stay away,0
place disgust,0
check everywhere feature really disappointing,0
tapa dish delicious,1
old nokia tracfone hold charge lot good,0
awesome device,1
well wouldve give godfather zero star possible,0
wait forty five minute vain,0
give one look,1
sad movie good,1
love place,1
poor service waiter make feel like stupid every time come table,0
character interesting want find longer movie go think people surprise doesnt make,1
one thing hate mode set button side,0
phone might well bad ive ever brand,0
superb phone great network,1
voice recognition tremendous,1
excellent wallet type phone case,1
attempt humor pitiful story awful dosent bear think basically involve vulcan steal enterprise find god seriously didnt care film oh mention uhura belly dance distract male guard,0
good money,0
movie completely perfect titta di girolamo stay long time vision movie,1
breakfast perpared great beautiful presentation giant slice toast lightly dust powdered sugar,1
audio quality poor poor,0
never din place,0
headphone great find think perhaps best purchase ive make last several year seriously,1
couldnt ask satisfying meal,1
little music anything speak,0
place amaze,1
really recommend faceplates since look nice elegant cool,1
guess know place would suck inside excalibur didnt use common sense,0
owner really great people,1
far work like charm,1
great place relax awesome burger beer,1
hate write bad review film especially really like star film bad dont believe one second anyone could proud,0
riot see hugo weave play sexobsessed gay real estate salesman use client house tryst flame darren tom hollander,1
could stand even watch long fear lose iq,0
due happen every call force stop use headset,0
great reception time,1
serious spoiler movie huge disappointment,0
make drive way north scottsdale one bit disappointed,1
think food flavor texture lack,0
refried bean come meal dry crusty food bland,0
far good,1
look great strong,1
movie contain allstar cast love open eye see actor havent see,1
selection menu great price,1
wont regret,1
dont know kind best iced tea,1
cast always entertaining usual,1
server negligent need make u feel unwelcome would suggest place,0
give star im give star,1
last minute movie also bad well,1
love headset bluetooth headset great reception good ear piece comfortable fit,1
much interesting action suspense less unneeded controversy,1
movie really get,1
sure lost flat character audience nearly half walk,0
felt insulted disrespect could talk judge another human like,0
burrittos blah,0
three break within two month use,0
warm feeling service felt like guest special treat,1
really impressive place hasnt close,0
year battery go completely dead headset,0
great product price,1
cant beat,1
pretty good beer selection,1
nargile think great,1
receive white colored battery go dead couple hoursthe original use last week still last long thereplacement,0
know saw film great thing come gift actor,1
jalapeno bacon soooo good,1
poor reliability,0
movie seem little slow first,0
wont regret,1
highly entertain angle,1
utterly confusing first cause lose couple important contact,0
colleague get great receptiona little expensive performance great,1
fun funny movie,1
phone pretty sturdy ive never large problem,1
one simply disappointment,0
place way overprice mediocre food,0
staff friendly wait time serve horrible one even say hi first minute,0
happy complaint one regarding sound quality end,1
budget evidently limited,0
special mention make superb music score sound effect integral element help make memorable enjoyable cartoon,1
saw movie think stupid movie,0
verizon year ago really like service,1
watch two sunday ago march begin really enjoy time tap entire thing,1
dont think back long time,0
line cut audio everything wrong,0
allow possibility double booking date time first,0
wouldnt return,0
great,1
food wasnt good,0
camera phone may use dustpan indoors id rather use disposable,0
husband ate lunch disappointed food service,0
give try happy,1
rest movie lack art charm meaning emptiness work guess empty,0
boyfriend sat bar completely delightful experience,1
never go back,0
burger good beef cook right,1
make case small difficult install,0
transfer good,1
consider relation screen taylor stanwyck surprise little chemistry screen two,0
weve get much good service pizza place next door service receive restaurant,0
recently witness poor quality management towards guest well,0
many continuity error one user comment different car garage joes glassesthe one get fact joes facial hair configuration seem change scene scene,0
absolute must visit,1
screamy masculine right,1
absolutely amazing,1
service meh,0
sound quality great,1
rude inconsiderate management,0
least pass u order food arriving wasnt busy,0
waitress good though,1
headset work peachykeen,1
love scream movie horror movie one rank way,1
great price,1
nobody identifies character theyre cardboard cutout stereotype predictably reversestereotypes,0
good transmit audio,1
go bachi burger friends recommendation disappointed,1
many close ups,0
acting fantastic story seamlessly weave together dog splendid must rent view see,1
really ugly,0
horrible switch time,0
great food price high quality house make,1
customize order way youd like usual eggplant green bean stir fry love,1
good value great food great service,1
find product easy set use,1
side delish mixed mushroom yukon gold puree white corn beateous,1
like,1
hopefully director jam cox turn short feature length film cast win u whole new film,1
time side restaurant almost empty excuse,0
place lack style,0
wait thirty minute seat although vacant table folk wait,0
light weight hardly notice,1
two bite refuse eat anymore,0
still maintain monkey shouldnt make headphone obviously dont share enough dna copy design human,0
acting youd expect cast top notch,1
wait wait,0
walk place smell like old grease trap others eat,0
needless say never back,0
unreliable service tmobile,0
week far good,1
dont go,0
song could explain emotion subject well jay adam unfortunate life subject talk song old man neil young play evoke many emotion,1
dont waste money,0
great restaurant mandalay bay,1
service terrible though,0
ambiance feel like buffet set douchey indoor garden tea biscuit,0
im sure long stand long enough begin feel awkwardly place,0
possesed get junk idea,0
awesome selection beer,1
back,1
maintain connection computer lap,0
design flaw,0
bad one series,0
doesnt make look cool,0
case flimsy piece plastic front side protection whatsoever,0
moviemaking,0
tom wilkinson break heart end everyone elses judge amount fumble hanky hand go face among male female alike,1
go lunch service slow,0
pro large seat area nice bar area great simple drink menu best brick oven pizza homemade dough,1
script look rough draft write shoot begin finished script complete,0
much good hard plastic case,1
john garfield ann revere lilli plmer william conrad canada leeand film one great cinematographer ever grace screenjames wong howe,1
awful dialogue hopeless overacting everyone get shoot top real waste space time,0
screams legit booksomethats also pretty rare vega,1
yes simplify thing sake brevity really core problem film much go without real fulfilling explanation,0
despite hard rate business actually rare give star,0
honest unbelievable nonsense foolish,0
